{
  "$schema": "../../../../packages/schemas/manifest/hauskraft.plugin.schema.json",
  "id": "dev.hauskraft.connector.paperless",
  "name": "Paperless-ngx",
  "version": "0.3.0",
  "type": [
    "connector",
    "widget"
  ],
  "hauskraft_api": ">=1.0 <2.0",
  "license": "MIT",
  "authors": [
    {
      "name": "Hauskraft contributors"
    }
  ],
  "source": "https://github.com/hzmchen/plugin-paperless",
  "runtime": {
    "kind": "container",
    "image": "ghcr.io/hauskraft/plugin-paperless",
    "digest": "sha256:0000000000000000000000000000000000000000000000000000000000000000"
  },
  "config_schema": {
    "type": "object",
    "required": [
      "base_url"
    ],
    "properties": {
      "base_url": {
        "type": "string",
        "format": "uri"
      }
    }
  },
  "secrets": [
    "paperless_api_token"
  ],
  "capabilities": [
    "net:egress:paperless.lan:8000",
    "graph:write:Document",
    "graph:read:Property",
    "llm:invoke:financial",
    "notify:inbox"
  ],
  "data_classes": {
    "reads": [
      "financial",
      "tenant",
      "health"
    ],
    "writes": [
      "financial"
    ],
    "emits": [
      "financial",
      "tenant",
      "health"
    ]
  },
  "subscribes": [
    "hauskraft.deadline.created"
  ],
  "contributes": {
    "tools": [
      {
        "name": "paperless.search",
        "description": "Search the household's documents by text, tag or correspondent.",
        "annotations": {
          "read_only": true,
          "open_world": false
        }
      },
      {
        "name": "paperless.tag_document",
        "description": "Add a tag to a document.",
        "annotations": {
          "read_only": false,
          "destructive": false,
          "idempotent": true
        },
        "verify": {
          "tool": "paperless.get_document",
          "assert": "$.tags[*] contains input.tag"
        }
      }
    ],
    "widgets": [
      {
        "id": "inbox",
        "title": "Document inbox",
        "resource": "ui://paperless/inbox",
        "default_size": {
          "w": 4,
          "h": 4
        },
        "roles": [
          "owner",
          "adult"
        ]
      }
    ],
    "entities": [
      {
        "type": "Document",
        "jsonld": "https://schema.org/DigitalDocument"
      }
    ]
  }
}
