{
  "id": "org.example.theme.probe",
  "name": "Probe",
  "version": "0.1.0",
  "type": [
    "theme",
    "widget"
  ],
  "hauskraft_api": "^0.1.0",
  "license": "MIT",
  "authors": [
    {
      "name": "Hauskraft tests"
    }
  ],
  "source": "https://example.org/probe",
  "runtime": {
    "kind": "inprocess",
    "entrypoint": "x:y"
  },
  "capabilities": [
    "graph:read:Task"
  ],
  "data_classes": {
    "reads": [],
    "writes": [],
    "emits": []
  },
  "contributes": {
    "themes": [
      {
        "id": "probe",
        "file": "theme.json"
      }
    ]
  }
}
