{
  "$schema": "../../../packages/schemas/manifest/hauskraft.plugin.schema.json",
  "id": "dev.hauskraft.theme.hackspace",
  "name": "Hackspace",
  "version": "0.1.0",
  "description": "Underground hackerspace: near-black with phosphor green and magenta, square corners, monospace type and pixel icons; a green-ink printout in light mode.",
  "type": ["theme"],
  "hauskraft_api": "^0.1.0",
  "license": "MIT",
  "authors": [
    {
      "name": "Hauskraft contributors"
    }
  ],
  "source": "https://github.com/hzmchen/hauskraft/tree/main/themes/builtin/hackspace",
  "runtime": {
    "kind": "declarative"
  },
  "capabilities": [],
  "data_classes": {
    "reads": [],
    "writes": [],
    "emits": []
  },
  "contributes": {
    "themes": [
      {
        "id": "hackspace",
        "file": "theme.json"
      }
    ]
  }
}
