{
  "$schema": "../../../packages/schemas/manifest/hauskraft.plugin.schema.json",
  "id": "dev.hauskraft.theme.paper",
  "name": "Paper",
  "version": "0.1.0",
  "description": "Ink on paper: high contrast, flat, serif headings and Atkinson Hyperlegible Next body text.",
  "type": ["theme"],
  "hauskraft_api": "^0.1.0",
  "license": "MIT",
  "authors": [
    {
      "name": "Hauskraft contributors"
    }
  ],
  "source": "https://github.com/hzmchen/hauskraft/tree/main/themes/builtin/paper",
  "runtime": {
    "kind": "declarative"
  },
  "capabilities": [],
  "data_classes": {
    "reads": [],
    "writes": [],
    "emits": []
  },
  "contributes": {
    "themes": [
      {
        "id": "paper",
        "file": "theme.json"
      }
    ]
  }
}
