{
  "$schema": "../../../../packages/schemas/manifest/hauskraft.plugin.schema.json",
  "id": "org.example.theme.warn-partial-icons",
  "name": "Warn Partial Icons",
  "version": "0.1.0",
  "type": [
    "theme"
  ],
  "hauskraft_api": "^0.1.0",
  "license": "MIT",
  "authors": [
    {
      "name": "Hauskraft test fixtures"
    }
  ],
  "source": "https://github.com/hzmchen/hauskraft/tree/main/tests/fixtures/themes/warn-partial-icons",
  "runtime": {
    "kind": "declarative"
  },
  "capabilities": [],
  "data_classes": {
    "reads": [],
    "writes": [],
    "emits": []
  },
  "contributes": {
    "themes": [
      {
        "id": "warn-partial-icons",
        "file": "theme.json"
      }
    ]
  }
}
